{
  "schema_version": "1.0",
  "id": "app_example_backend",
  "job_id": "job_example_backend",
  "status": "preparing",
  "created_at": "2026-08-09T12:10:00Z",
  "updated_at": "2026-08-09T12:10:00Z",
  "artifacts": {
    "job_record": "../jobs/job_example_backend.json",
    "jd_snapshot": "jd.md",
    "tailored_resume": "tailored-resume.md",
    "claim_ids": ["claim_order_platform_cache_01"]
  },
  "interviews": [],
  "next_action": "针对缓存 claim 完成三层追问训练后再投递。"
}
